post_id,content
1,"<p>As cyber threats evolve, so too must our defense mechanisms. In 2025, artificial intelligence stands at the forefront of cybersecurity innovation, enabling organizations to detect, prevent, and respond to attacks with unprecedented speed and precision.</p><h2>From Reactive to Proactive Defense</h2><p>AI-driven systems have shifted the paradigm from reactive security to proactive protection. Machine learning algorithms can now identify anomalous behaviors long before a human analyst would notice them, predicting potential breaches based on subtle data patterns.</p><h2>Threat Intelligence and Automation</h2><p>Modern Security Operations Centers (SOCs) are adopting AI-powered threat intelligence platforms that correlate billions of data points across the globe. These systems automatically prioritize alerts, reducing noise and allowing analysts to focus on high-impact incidents.</p><blockquote>AI isn’t replacing security professionals — it’s empowering them to focus on strategy over firefighting. - Dr. Emily Carter</blockquote><h2>The Ethical Challenge</h2><p>While AI enhances defense, it also introduces new ethical questions. Malicious actors are leveraging AI to automate phishing, create deepfake scams, and craft adaptive malware. Balancing innovation with accountability has become a defining challenge of modern cybersecurity.</p><h2>Looking Ahead</h2><p>AI’s role in cybersecurity will continue to expand. The most secure organizations in 2025 will be those that embrace machine learning, automation, and human expertise in harmony — forming a true “human-in-the-loop” defense model.</p>"
2,"<p>Ransomware has become more than a nuisance — it’s a business model. In 2025, cybercriminals have moved beyond simple encryption attacks to a new phase: double and even triple extortion, where stolen data becomes leverage.</p><h2>The New Business of Cybercrime</h2><p>Ransomware-as-a-Service (RaaS) has lowered the barrier to entry for attackers. Even low-skilled hackers can launch sophisticated attacks by purchasing pre-built kits on the dark web.</p><h2>Double Extortion Explained</h2><p>Attackers now steal sensitive data before encrypting systems. Victims who refuse to pay face public exposure, regulatory fines, and reputational damage. Some gangs even target customers of their victims to increase pressure.</p><blockquote>Ransomware isn't just about encryption anymore — it's about control, data leverage, and manipulation. - Michael Torres</blockquote><h2>Prevention Through Preparedness</h2><p>Zero-trust architectures, robust backups, and employee awareness training remain the most effective defense. Incident response plans should include legal, PR, and technical teams working together to mitigate both encryption and extortion threats.</p>"
3,"<p>Cloud services have transformed business agility — but they’ve also expanded the attack surface. In 2025, 85% of organizations report at least one cloud security incident due to misconfigurations or poor identity management.</p><h2>Identity and Access Control</h2><p>Strong IAM (Identity and Access Management) practices are non-negotiable. Implement least privilege, enforce MFA, and continuously monitor permissions creep across accounts and services.</p><h2>Configuration and Visibility</h2><p>Use Cloud Security Posture Management (CSPM) tools to detect misconfigurations in real time. Visibility is key — you can’t secure what you can’t see.</p><blockquote>Cloud security is a shared responsibility — between provider, developer, and user. - Priya Deshmukh</blockquote><h2>Emerging Trends</h2><p>Infrastructure-as-Code (IaC) scanning, AI-driven compliance checks, and automated remediation are rapidly becoming the standard for secure cloud operations.</p>"
4,"<p>Ethical hacking has evolved into a global movement where white-hat hackers collaborate with organizations to find and fix vulnerabilities before criminals exploit them. Platforms like HackerOne and Bugcrowd have turned security testing into a thriving ecosystem.</p><h2>The Rise of Bug Bounties</h2><p>Companies from startups to governments now offer financial rewards for discovering and responsibly disclosing vulnerabilities. This model democratizes security, leveraging global expertise while reducing risk.</p><blockquote>The best way to defend your system is to invite the world’s smartest people to try to break it — ethically. - Jason Miller</blockquote><h2>Ethics and Responsibility</h2><p>Responsible disclosure remains a cornerstone of trust between hackers and organizations. It ensures vulnerabilities are fixed before being publicized, protecting users and infrastructure alike.</p>"
5,"<p>Zero Trust is more than a marketing term; it’s a philosophy that assumes no user, device, or application should be inherently trusted. Every request must be verified, every action monitored, and every breach contained.</p><h2>Core Principles</h2><p>Zero Trust is built on the pillars of continuous verification, least privilege, and micro-segmentation. It emphasizes identity-centric access control and real-time risk assessment.</p><blockquote>Never trust, always verify — but always enable productivity. - Rachel Nguyen</blockquote><h2>Implementation Strategy</h2><p>Adopting Zero Trust is a journey, not a destination. Start by mapping data flows, segmenting networks, and integrating identity-based access policies. Combine with EDR, CASB, and SIEM for full visibility.</p>"
